Date,Country,Casualties,Type,Description,Source(s),Year
17 September 2016,India,5,Drowned,"Six young women (engineering students from Vaagdevi college of Engineering, Bollikunta) were standing on a rock at the edge of a reservoir in Warangal Urban district of Telangana, India, taking selfies. One student slipped and fell into the lake, and one after another the rest went in to save her. One student survived, five drowned.",[132][133],2016
18 September 2016,Kenya,1,Animal,"A 66-year-old Italian tourist visiting Kenya was having breakfast with his wife in a tent at the Swara Camp in Kulalu ranch. He saw wild elephants and approached them closely. While taking a selfie he was charged by an elephant, sustained serious injuries to his leg and died at the camp.",[134],2016
1 October 2016,Nepal,1,Fall,A 19-year-old man from Nepal was taking a selfie when he slipped off a cliff and fell into Dordi stream in Lamjung district. His body was not immediately recovered.,[135],2016
1 October 2016,India,2,Drowned,"Two teenagers from Hyderabad were taking selfies in a quarry recently filled with rainwater. They went too deep and, unable to swim to shore, they drowned.",[136],2016
8 October 2016,Oman,2,Drowned,"Two Sri Lankan girls were visiting Ain Garziz in Oman with their families. While at a picnic, they were taking selfies near a deep spring. One girl slipped into the spring and grabbed the hand of the other. She was unable to pull her companion out and was dragged down into the water where both of the girls drowned.",[137],2016
9 October 2016,India,1,Fall,A 25-year-old Indian man fell to his death while taking a selfie with his friends at Lion's Point Valley near Lonavla. He slipped and fell 200 feet (61 m) into a gorge and died on the spot.,[138],2016
9 October 2016,Sri Lanka,1,Transport,A Chinese woman visiting Sri Lanka fell from a moving train while taking a selfie. She later died from her injuries.,[139],2016
11 October 2016,India,1,Drowned,"A student drowned in the Jaldhaka River at Bindu village, Kalimpong subdivision in West Bengal. The body was retrieved four days later.",[140],2016
12 October 2016,India,1,Drowned,"A 25-year-old software engineer fell into a river and drowned in Gajapati, Odisha, India, while taking a selfie.",[141],2016
18 October 2016,Russia,1,Fall,A 12-year-old Russian schoolgirl climbed over a balcony on the 17th floor of a building and fell while taking a selfie.,[142],2016
11 November 2016,India,2,Drowned,Two students drowned while taking selfies; they were swept away by currents in the Nagarjuna Sagar canal.,[143][144],2016
1 January 2017,India,1,Transport,"A 21-year-old engineering student died when he was hit by a speeding train while trying to take a selfie in Coimbatore, Tamil Nadu, India.",[145][146],2017
4 January 2017,Pakistan,1,Drowned,"In Sukkur, Pakistan, a man fell into the Indus River and drowned as he tried to capture his selfie at the Lansdowne Bridge Rohri. Asif Jamil, a resident of Christian Colony, was visiting the bridge with his wife for a picnic.",[147],2017
6 January 2017,Croatia,2,Electrocution,"In Rijeka, Croatia, two men climbed onto a container on a train where they wanted to take a selfie. A 20-year-old was killed and his 19-year-old friend was in serious condition, with second and third degree burns on more than 70 percent of his body as a result of an electric shock of 25,000 volts.",[148],2017
13 January 2017,India,1,Drowned,"A woman, Ashana Bhandari, fell into the Alaknanda River while she was trying to take a selfie near Koteshwar temple in Rudraprayag district in Uttarakhand, India.",[149],2017
14 January 2017,India,1,Transport,"A second-year college student died while taking a selfie in front of a running train on a railway track in Chandrakona Road, Paschim Medinipur district, West Bengal, India. He was immediately hit by the speeding train and died on the spot.",[150],2017
14 January 2017,India,2,Transport,"Two teenagers were crushed under a train while posing between two railway tracks at Anand Vihar, east Delhi. They had decided to go to the Anand Vihar railway lines to click ""daring selfies"" for their social media profiles.",[151],2017
25 January 2017,India,1,Transport,"A 22-year-old man died while attempting to take a selfie on the railway tracks near Dhuri Lines, Ludhiana, Punjab, India. A passenger train hit him while he was taking selfies.",[152],2017
5 February 2017,India,1,Fall,"A 22-year-old college student died after falling into a 50-metre-deep ravine while taking a selfie near Kolukhet on Dehradun-Mussoorie road in Uttarakhand, India.",[153],2017
9 February 2017,New Zealand,1,Drowned,"Four women were taking selfies on a rock in a river in New Zealand, ignoring a warning siren signalling a dam was about to be opened. One of the women, a 21-year-old university student, was swept to her death by the dam surge.",[154][155],2017
25 March 2017,United States,1,Drowned,"A 14-year-old girl was standing on a log with friends at a beach in Bandon, Oregon to pose for photos, possibly including selfies. She fell off and was pinned underwater by the log due to the receding tide. According to the girls mother, when this occurred it was not a selfie rather her picture was being taken by a friend.",[156][157],2017
25 March 2017,Mexico,2,Transport,"In the city of Chínipas de Almada, Chihuahua, Mexico, two girls aged 17 and 18 went to see horse races at a track next to an airport runway. They decided to get on top of their pickup's roof, and started taking selfies as a plane was landing. The plane's wing fatally injured both girls. This would later earn them a Darwin Award.",[158][159],2017
13 April 2017,India,5,Transport,"Police said Taraknath Makal was travelling by train with four friends – all aged between 25 and 30 years – when he reportedly leaned out of the door to take a selfie. However, he lost his footing and fell off the train. Makal’s companions jumped out to save him, but ended up getting mowed down by another train coming from the opposite direction. While the four friends – Sumit Kumar, Sanjiv Polley, Kajal Saha and Chandan Polley – lost their lives, Makal is fighting for his life in a hospital.[needs update] The incident occurred between Liluah and Belur stations, in the vicinity of Howrah, India.",[160],2017
30 April 2017,Germany,1,Transport,"A Scottish man was knocked down and killed after trying to take a selfie on a German motorway. He was with two friends when he was hit by a car on the A24 Autobahn in Gudow, near Hamburg. Witnesses reported seeing the three men taking ""cell phone pictures of themselves"".",[161],2017
24 May 2017,India,2,Drowned,"Two youths 21 and 22 years old from Hooghly district, India, drowned in a fish pond while taking a selfie as they did not know how to swim. They were taking selfies in waist-deep water but suddenly, the duo slipped from the bank and went underwater. The locals first failed to find their bodies. Later, divers from Kolkata recovered both the bodies from the pond.",[162],2017
30 May 2017,India,2,Transport,"At Alwal Railway station near Secunderabad, India, a man died while another lost his hand when the duo was run over by a moving train while taking selfies.",[163],2017
7 June 2017,India,1,Animal,A man in Dhenkanal district was seriously injured by a wild elephant when he tried to take a selfie with the animal.,[164],2017
11 June 2017,Sri Lanka,2,Transport,"Two youths from same family in Sri Lanka were killed when they were hit by a train while they were taking a selfie standing on the rail track. According to the police, the two brothers, aged 25 and 12, were standing on the coastal train track between the Bambalapitiya and Kollupitiya stations and attempting to take a selfie when they were hit by Aluthgama bound express train from Maradana to Galle.",[165],2017
11 June 2017,Russia,4,Transport,"Four children aged 10 to 13 were hit by a train while trying to take a selfie on a railway line in Nadezhdinsky District of Primorsky Krai, 43 km northwest of Vladivostok, Russia. Three were killed and one survived with injuries.",[166][167],2017
13 June 2017,Sri Lanka,2,Transport,"A 24-year-old groom was killed and his bride seriously injured when the newly-wed couple tried to take a selfie on the railway track at Kahawa, in the Southern Province, Sri Lanka. According to eyewitnesses, the couple had ignored warning signals given by the people in the area saying that the train was coming.",[168],2017
13 June 2017,Russia,1,Electrocution,"A 15-year-old boy was killed when he tried to climb onto a high-voltage wire to take a selfie in Perm Krai, Russia.",[169],2017
16 June 2017,Russia,1,Electrocution,"A 17-year-old boy was killed when he took a selfie near a high-voltage electric cable in Novosibirsk Oblast, Russia.",[169],2017
17 June 2017,Russia,1,Electrocution,"A 14-year-old girl was electrocuted when taking a selfie on a railway bridge in Moscow Oblast, Russia, when her head accidentally touched the overhead wires.",[169],2017
22 June 2017,United Kingdom,1,Fall,A 23-year-old woman from South Korea fell from Seaford Head while jumping in the air to pose for a photo.,[170],2017
1 July 2017,Nigeria,2,Drowned,"Four undergraduate students of the Federal University of Technology, Akure, Nigeria were taking selfies in a canoe while boating on a campus pond. The canoe capsized. Two students who could swim barely made it to safety while two others drowned.",[171],2017
16 July 2017,India,48,Fire,"48 people were injured when standing too close to a burning bakery in Chennai, India to take selfies. They repeatedly ignored warnings advising them to move away from the blaze.",[172],2017
25 July 2017,India,1,Animal,"A 30-year-old man sneaked into the Bannerghatta Biological Park near Bangalore, India, with friends to take selfies with an elephant that later trampled him to death.",[173],2017
26 July 2017,Hungary,1,Fall,A local girl fell off a bridge in Budapest suffering serious injuries while taking a selfie.,[174],2017
26 July 2017,India,1,Drowned,"An 18-year-old was swept into the sea and drowned while he was taking a selfie at a beach in Mumbai, India during high tide.",[175],2017
11 August 2017,India,1,Electrocution,"A 17-year-old boy climbed on top of a train in Ambarnath, India to take a selfie but came into contact with a live wire, suffering severe injuries from the resulting electric shock.",[176],2017
26 August 2017,India,1,Electrocution,"A 17-year-old boy attempted to take a selfie on top of a train carriage in Tambaram railway station, India. He touched a live wire, suffered severe burns from electric shock and died four days later.",[177],2017
2 September 2017,India,1,Animal,"A youth in Rourkela, Odisha was trampled to death by a wild elephant while trying to take a selfie with the animal.",[178],2017
12 September 2017,United Kingdom,1,Transport,"A 41-year-old woman from New Zealand who took a selfie as she rode her bike died after she fell off shortly afterwards, following a night out to celebrate her mum's birthday in London. Graphic designer and mother-of-two was with mum when they rode home from the pub and the accident happened, an inquest into Greenway's was told on Thursday. The 41-year-old had drunk two cocktails and four glasses of wine. But she was not wearing a helmet and may have been riding relaxed and one-handed when she tumbled to the floor, suffering fatal head injuries.",[179],2017
16 September 2017,Malaysia,1,Fall,"A 20-year-old man believed to be taking a selfie died after he fell from the 16th floor of a resort hotel in Genting Highlands, Pahang, Malaysia. It is believed that he had climbed a wall on the 16th floor of the hotel’s car park to take photographs when he slipped and fell.",[180],2017
12 November 2017,United Kingdom,1,Fall,A 20-year-old woman from New Zealand died on November 14 after she allegedly attempted to take a selfie near a second-storey window in London. She suffered a serious brain injury as a result of the fall.,[181],2017
25 December 2017,Mexico,1,Fall,"A 20-year-old woman from Aguascalientes (Mexico) died during a selfie session in the Malpaso Dam, a popular spot in the State of Aguascalientes. According to witnesses, she accessed a restricted zone to take the selfie before slipping and falling 15 meters, dying from severe craneoencephalic traumatism.",[182],2017
8 January 2018,Croatia,1,Electrocution,"In Zagreb, Croatia, 14-year-old boy climbed onto the roof of a train cargo wagon where he wanted to take a selfie. He was electrocuted and his body ""burned like a torch"". Firefighters could not do anything until the power was turned off.",[183],2018
11 January 2018,Colombia,1,Fall,"In Gámbita, Santander, Colombia A 19-year-old girl fell while trying to take a selfie at ""Manto de la Virgen"" falls.",[184],2018
24 January 2018,India,1,Transport,"A 22-year-old Indian man was struck by a train while recording a selfie video very close to some train tracks. His selfie video captured the entire incident, showing the man being struck after brazenly ignoring the train's horn. The video released went viral, However, some media are reporting that it was a hoax and that the man is still alive with no injuries.",[185][186],2018
9 February 2018,Thailand,2,Transport,"A 22-year-old Thai woman died as a result of her injuries when a train hit her while attempting to take a photo with an outgoing train in the background near Samsen train station in Bangkok’s Phaya Thai district. A man, believed to be a colleague of the victim, was knocked unconscious by the train, suffering a head injury and a broken arm.",[187],2018
20 April 2018,Greece,1,Fall,"In Keratsini, Greece, a 16-year-old boy died after he fell from a height of 60 meters after climbing on a rock to take a selfie at a park.",[188],2018
22 April 2018,Brazil,3,Fall,"In Castelo do Piauí, Piauí, Brazil A 22-year-old woman and two girls aged 16 and 15 fell from a height of 10 meters when taking a selfie on a bridge in Piauí, Northeast Brazil when the platform on the side of the bridge collapsed. They suffered fractures.",[189],2018
30 April 2018,Brazil,1,Fall,"At Corumbá Lake in Caldas Nova, a 34-year-old man ended up drowning, after falling off a platform in an attempt to take a selfie.",[190],2018
2 May 2018,India,1,Animal,"In Nabarangpur, Odisha, India, a man tried to take a selfie with a wounded bear and was mauled to death.",[191],2018
11 June 2018,Indonesia,1,Fall,"A 46 year old Chinese tourist died after falling into the sea while taking a selfie on a cliff at Devil's Tears on Nusa Lembongan, an island off the coast of Bali.",[192],2018
12 June 2018,Portugal,2,Fall,"On the Praia dos Pescadores, Ericeira, Portugal, an Australian couple fell to their deaths when they tried to take a selfie on a 30 meter high wall.",[193],2018
5 September 2018,United States,1,Fall,An Israeli teen fell to his death while trying to take a selfie at Yosemite National Park.,[194],2018
19 September 2018,United States,1,Fall,A Californian woman fell to her death while taking selfies on the edge of a 200-foot cliff over Lake Superior at Pictured Rocks National Lakeshore.,[195],2018
12 October 2018,Panama,1,Fall,A Portuguese woman fell to her death while taking a selfie on the 27th floor balcony of a panamanian residential building.,[196],2018
