Date,Country,Casualties,Type,Description,Source(s),Year
15 October 2011,United States,3,Transport,"Three teenagers (two sisters and a friend) were killed by a train while posing for a selfie, which is just visible in the final picture they posted to Facebook along with the caption ""Standing right by a train ahaha this is awesome!!!!"".",[8][9],2011
13 December 2013,United Kingdom,1,Transport,"A 17-year-old girl committed suicide by jumping in front of a Central line train at Redbridge tube station. She took a selfie of the incident which she titled ""last pic before I die"". She was reportedly distraught over gossip about pictures she’d sent to a boy.",[10],2013
March 2014,Spain,1,Electrocution,A 21-year-old man was electrocuted after climbing on top of a train to take a selfie with friends and touching a wire that (contrary to the assumptions of the group) turned out to be live. One of the friends was hospitalized in serious condition.,[11],2014
April 2014,United States,1,Transport,"A 32-year-old woman from North Carolina was driving when her vehicle veered across the center median, collided with a recycling truck, left the road, hit a tree, and burst into flames – moments after posting selfies online when she heard Pharrell Williams' song ""Happy"". The truck driver was unharmed.",[12][13],2014
May 2014,India,1,Transport,A 15-year-old boy was killed by a train while posing for a selfie on the tracks.,[14],2014
June 2014,Italy,1,Fall,A 16-year-old girl died in Taranto after plunging 60 feet onto rocks while she was trying to take a photograph of herself on the seafront.,[15],2014
July 2014,Philippines,1,Fall,"A 14-year-old high school student in the Philippines fell to her death after losing her balance while taking a selfie with a friend near a staircase landing of their school in suburban Pasig. According to doctors, she sustained a sharp blow to the head from the fall and broke a rib which pierced a kidney.",[16],2014
August 2014,Philippines,1,Firearm,A 15-year-old boy in the Philippines was critically wounded after accidentally shooting himself while taking a selfie in which his other hand was holding a gun to his chin.,[17],2014
2 August 2014,Mexico,1,Firearm,A 21-year-old man was drinking with friends and took a selfie to post on Facebook. He posed with a gun pointed at his face. The man accidentally shot himself and he was declared dead at the scene.,[18][19],2014
August 2014,Portugal,2,Fall,A Polish couple fell to their death off a cliff in Portugal after crossing a safety barrier to take a selfie with their children. Their two children who were present at the scene survived.,[20],2014
August 2014,India,1,Electrocution,"In Kerala, a 14-year-old boy was electrocuted while attempting to take a selfie on top of a stationary train.",[21],2014
August 2014,United States,1,Transport,"A 36-year-old man, of Niagara, N.D., struck and killed a 54-year-old woman of Portland, N.D. while driving. She was riding a bicycle and he was distracted as he took a selfie, striking her from behind with his vehicle.",[22],2014
October 2014,Philippines,1,Drowned,An 18-year-old woman in the Philippines was posing for a group selfie on a beach with friends. She was captured by a strong wave and drowned.,[23][24][25],2014
November 2014,Spain,1,Fall,"A 23-year-old student from Poland fell to her death while trying to take a selfie on the ledge of the Triana Bridge in Seville, Spain.",[26][27],2014
January 2015,South Africa,1,Fall,"A 21-year-old woman died after falling from Northcliff Hill, Johannesburg, as a male companion was setting up a tripod for a selfie. Reports vary as to the identity of the companion.",[28][29],2015
January 2015,Russia,2,Other,Two young men died in the Ural Mountains after they pulled the pin from a live hand grenade to take a selfie. The phone with the picture remained as evidence of the circumstance of their deaths.,[30],2015
January 2015,India,3,Transport,"Three students aged 20 to 22 died trying to take a ""daredevil selfie"" close to an oncoming train on railway tracks of Mathura, near Kosikala.",[31],2015
4 February 2015,India,1,Transport,"An Israeli man traveling on a train from Mumbai to Goa in India was attempting to take a selfie and fell out of the moving train, resulting in his death.",[32],2015
21 February 2015,United States,1,Transport,"A man in Kalama, Washington, stepped out onto a railroad track to take a selfie with himself and a woman with a passing train in the background. The man misjudged which track the oncoming train was on and was struck and died at the scene.",[33],2015
March 2015,India,7,Drowned,"Seven youths drowned while taking selfies on Mangrul Lake near Kuhi, about 20 km from Nagpur, India. Their boat had tipped over as they were standing up to pose.",[34][35],2015
April 2015,Serbia,1,Transport,"A 22-year-old man was trying to recreate a scene from his favorite movie Barking at the Stars by running in front of a train, beating it and being hailed a hero. As he ran in front of the train, he tried to take a selfie to document the scene. He was killed instantly when the express train hit him at full speed in the village of Laćarak near the northern Serbian town of Sremska Mitrovica.",[36],2015
1 April 2015,Italy,1,Fall,"A 60-year-old German tourist skiing in the Trentino-Alto Adige region of Italy was reported missing when he failed to pick up his children from ski school. Subsequent investigation found that while skiing alone, he took off his skis and went off-trail to take a selfie next to a cliff, where he slipped and plunged 200 metres to his death.",[37],2015
May 2015,Romania,2,Electrocution,"An 18-year-old died when she attempted to take the ""ultimate selfie"", posing with a friend on top of a train in the north-eastern Romanian city of Iași when her leg touched a live wire above which electrocuted her with 27,000 volts. A 17-year-old friend who accompanied her was hospitalised.",[38],2015
May 2015,Russia,1,Electrocution,A teenage boy climbed on a railway bridge in Ryazan Oblast of Russia to take a selfie and died when he came in contact with live wires.,[39],2015
May 2015,Russia,1,Firearm,"A 21-year-old woman asked a security guard at her office to give her a 9-millimeter rubber-bullet pistol for taking a selfie and accidentally shot herself in the head, sustaining heavy injuries.",[40],2015
May 2015,Indonesia,1,Fall,A 21-year-old man from Yogyakarta fell into the crater of Mount Merapi while attempting to take a selfie and died.,[41][42],2015
May 2015,Indonesia,1,Fall,"A Singaporean tourist died after falling into the sea while taking a selfie on a cliff in Nusa Lembongan, an island off the coast of Bali.",[43],2015
June 2015,Pakistan,1,Firearm,"A 15-year-old boy in Pakistan was taking selfies with a toy gun when police opened fire on him, killing him.",[44],2015
June 2015,Russia,2,Electrocution,"Two teenage girls were electric shocked, but survived, at a railroad yard in the city of Taganrog in southern Russia. They tried to climb on the tank car of an old freight train that was standing at the platform in order to take a selfie, but didn’t realize it was still in use and on a live track.",[45],2015
June 2015,Croatia,1,Fall,A 54-year-old Slovak tourist visiting Plitvice Lakes National Park in Croatia fell to her death from a rock while taking a selfie.,[46][47],2015
July 2015,Russia,1,Fall,A 21-year-old university graduate died after falling from a bridge while she was trying to take a memorable selfie next to the Moscow International Business Center.,[48],2015
July 2015,United States,1,Animal,A man from San Diego was hospitalised for five days following an attempt to take a selfie with a rattlesnake which then bit him.,[49][50],2015
July 2015,United States,1,Animal,A woman in Yellowstone National Park was gored by an American bison while taking a selfie. She was treated for injuries.,[51],2015
July 2015,Philippines,1,Transport,"A woman vacationing in Pagudpud, Ilocos Norte, asked her family to stop their car so she could take a selfie by the side of the road with a scenic view. She was hit by a speeding motorcycle while taking the picture. She was taken to hospital and died. The driver of the motorcycle was a minor.",[52],2015
August 2015,Spain,1,Animal,A man was gored to death in the annual bull-running festival in the town of Villaseca de la Sagra while trying to take a selfie with a bull.,[53],2015
August 2015,China,1,Fall,"A man was discovered with his phone and selfie stick at the bottom of a 100-foot cliff at Long Men waterfall in Zhejiang. Based on photographic evidence on his phone, local police speculated that he lost his footing while taking a selfie and fell to his death. It was not known when he died or how long his body had been there.",[54],2015
September 2015,United States,1,Firearm,A 19-year-old from Houston died after trying to take an Instagram selfie while holding a loaded gun to his head. He accidentally fired the gun and shot himself in the throat.,[55],2015
September 2015,India,1,Fall,"A Japanese tourist fell down a staircase to his death while taking a selfie at the Taj Mahal, Agra, India.",[56],2015
September 2015,Russia,1,Fall,"A 17-year-old student, Andrey Retrovsky from Vologda, Russia, fell to his death attempting to take a selfie while hanging from a rope from a nine-story building. The rope snapped. Retrovsky was known for taking 'extreme' selfies and posting them to his Instagram account ""drewsssik"".",[57][58],2015
September 2015,India,1,Fall,"An engineering student died while taking selfies with friends at Kolli Hills, Namakkal, Tamil Nadu, when the rock on which he was standing cracked and gave way, plunging him 60 feet and causing his death from head injuries.",[59][60],2015
October 2015,Spain,1,Electrocution,A 14-year-old from Barcelona was hospitalised with electric shock after trying to take a selfie on the roof of a train car.,[61],2015
October 2015,Chile,1,Other,"A 68-year-old Belgian woman was visiting the El Tatio geyser field located within the Andes Mountains of northern Chile. While attempting to take a selfie in front of an active geyser she stepped backwards and fell into the scalding hot water. Her husband pulled her out, but she died in hospital days later from burns over 85 percent of her body.",[62],2015
November 2015,India,2,Drowned,"Two engineering students of Wadhwan, Gujarat, drowned in Narmada Canal after slipping down the bank while taking selfies.",[63],2015
November 2015,India,2,Transport,"A first-year student of College Sourav Dey died and another was critically injured in the Kalyani area in Nadia district of West Bengal, India, as they were run over by a train while they were taking selfies.",[64],2015
November 2015,India,1,Electrocution,"A 14-year-old boy, who was trying to take a selfie atop a stationary train wagon at Nahur station yard in Mumbai, was electrocuted and died a few hours later. He accidentally came in contact with a 25,000-volt overhead wire and suffered 80 percent burns.",[65][66],2015
December 2015,Pakistan,1,Transport,"A 22-year-old man, the son of a railway employee of Rawalpindi, Pakistan, died while attempting to take a selfie while standing on the track in front of a moving train.",[67],2015
December 2015,Turkey,2,Transport,"Five teenagers laid down in the middle of the road near an airport to take a selfie with a plane landing in the background. It was at night, and a truck driver did not see them and accidentally ran them over, killing two of them. The teenagers had been drinking.",[68],2015
5 January 2016,Philippines,1,Fall,"A 19-year-old student fell to her death from the top of a 20-story apartment building in Manila, Philippines, while taking a selfie. According to her classmate, ""she was not satisfied with the photos they had taken so she decided to climb up the parapet wall"".",[69],2016
7 January 2016,Brazil,1,Fall,"A 27-year-old man fell into the sea and died after an attempt to take a selfie on the rocks of Cantão do Indaiá in Bertioga, on the coast of São Paulo.",[70],2016
9 January 2016,India,1,Fall,"A 20-year-old fell to his death while taking a selfie from the top of the Reasi Fort at Jammu and Kashmir, India.",[71],2016
9 January 2016,India,1,Drowned,"A 20-year-old college student drowned at Bandstand Promenade in Bandra, Mumbai. She is believed to have been swept away in the high tide. According to the woman's friends, they were taking selfies, standing on the rock, close to the Bandra-Worli Sea Link (BWSL). ""The girls were standing 50 metres away from the shore when the water suddenly rose. They did not notice water rising and remained on the rock taking pictures (selfies). One of the girls was pulled into the water due to high tide.""",[72][73],2016
1 February 2016,India,1,Transport,"A 16-year-old boy was killed by a passenger train while taking a selfie with an approaching train in Chennai, India. ""The teen reportedly walked in front of the train and waited for it to come closer before taking the photo.""",[74],2016
12 February 2016,India,3,Drowned,"Three students of Mandya Institute of Medical Sciences drowned after falling in an irrigation canal in Hulivana village, 180 km from Bengaluru, India, reportedly while they were taking selfies.",[75],2016
13 February 2016,India,2,Drowned,"An 18-year-old college student drowned after falling off of the Waldevi Dam in Nashik, India, while taking a selfie. His 18-year-old friend jumped into the water in an attempt to save him, but also drowned.",[76][77],2016
18 February 2016,Argentina,1 (dolphin),Other,An Argentinian crowd seeking selfies was held responsible for the death of a La Plata dolphin. It has however been claimed that the dolphin was already dead.,[78][79],2016
22 February 2016,India,5,Fall,"Five people in Anjuna, Goa, fell off a cliff and were injured after a gate they were leaning on gave way during a group selfie.",[80],2016
29 February 2016,Nepal,1,Drowned,A Nepalese woman drowned in the Narayani River. She dived into the river to save her friend who slipped into the water while the two were taking selfies together near the bank. The woman who originally fell was rescued but her friend who tried to save her died.,[81],2016
2 March 2016,United States,1,Firearm,"A 43-year-old man in Concrete, Washington, accidentally shot himself in the face with a gun and died while taking a selfie. He thought the gun was unloaded.",[82],2016
5 March 2016,Australia,1,Firearm,"A 22-year-old from Melbourne, Australia, was shot in the face with a sawn-off shotgun while posing for a selfie with the gun. The gun was fired by a friend who was holding it. The shooter fled the scene and was charged with murder.",[83][84],2016
12 March 2016,"Hong Kong, China",1,Fall,A 30-year-old man fell off Lion Rock in Hong Kong while taking a selfie and died.,[85],2016
5 April 2016,India,1,Fall,"A 16-year-old climbed a rock fountain at a zoo in Hyderabad, India, apparently to take a selfie. He slipped, fell into the water and may have hit his head on a rock. He was taken to hospital where his death was recorded.",[86][87],2016
15 April 2016,India,2,Transport,"Two youths were run over by a train while taking selfies on the railway tracks at Purushottampur railway crossing in Chunar area in Mirzapur district in Uttar Pradesh, India.",[88],2016
16 April 2016,Brazil,1,Fall,A 27-year-old woman fell from a height of 35m at a waterfall in the Ibitipoca State Park in Minas Gerais. She was rescued by the fire department and survived.,[89],2016
16 April 2016,India,1,Transport,"A 16-year-old boy died while taking a selfie at a railway crossing in Saharanpur, a town in Uttar Pradesh, India.",[90],2016
21 April 2016,Brazil,1,Fall,"In Campos dos Goytacazes in Rio de Janeiro, a 32-year-old woman died after she fell in a waterfall while attempting a selfie.",[91],2016
26 April 2016,India,1,Fall,"While taking a selfie, a 25-year-old fell off the Dolphin Nose cliff near Vattakanal village, situated 8 km from the Kodaikanal Lake, Tamil Nadu, India.",[92],2016
1 May 2016,India,1,Firearm,"A 15-year-old boy from Pathankot, India, died after he accidentally shot himself with his father's revolver while taking a selfie with the gun pointed at his head.",[93][94],2016
May 2016,China,2,Animal,"A Chinese businessman, at a local wildlife park in the city of Rongcheng, Shandong province, was drowned by a walrus after taking several selfies and videos with the animal. A zookeeper was also drowned in the same incident after attempting to save the man.",[95],2016
3 June 2016,India,1,Drowned,An 18-year-old boy drowned in the Ganges river while taking a selfie after bathing with his mother and a friend in Nabadwip of West Bengal state in India.,[96],2016
3 June 2016,United States,1,Firearm,"A 15-year-old from Overland, Missouri, accidentally shot and killed himself while attempting to take a selfie at home posing with his father's gun.",[97],2016
12 June 2016,India,2,Drowned,"A 23-year-old fell into the water and drowned at Sindhrot Check Dam near Vadodara, India, while taking a selfie. His friend jumped into the water to save him, but he also drowned.",[98],2016
18 June 2016,United States,1,Fall,"A 37-year-old EMS lieutenant of the New York City Fire Department, was mountain climbing near Lake George in the Adirondack Mountains. She was on a ledge at the top of Roaring Brook Falls preparing to take a selfie when she disappeared from sight. Rescue services found her body in the water at the base of the falls.",[99][100],2016
22 June 2016,India,7,Drowned,"Seven people aged 16 to 31 were swept away and drowned while taking a selfie in the river Ganges in Kanpur, Uttar Pradesh, India. According to a police official, they had gone for a picnic at Kanpur Ganges Barrage when one of the party tried to take a selfie by standing on the edge of the barrage and tripped and fell into the Ganges. The river was already in spate due to rains in the region. The six others, in an attempt to save him, jumped into the river but were themselves swept away by the current.",[101],2016
22 June 2016,India,1,Fall,"A third year engineering student of a Lonavla-based college and hailing from Nashik, lost his balance while taking a selfie from the Amrutanjan Bridge and fell down next to the Mumbai Pune Expressway in Maharashtra, India. He died on the spot.",[102][103],2016
29 June 2016,Peru,1,Fall,"A 28-year-old South Korean tourist plunged 1,600 feet (490 m) off a cliff at Gocta waterfall in the Amazonas Region of Peru. He was attempting to take a picture of himself. Divers and mountain rescue teams were brought in to recover the body submerged more than 20 feet underwater at the base of the falls.",[104],2016
29 June 2016,Peru,1,Fall,"A 51-year-old German tourist visiting Machu Picchu in Peru, fell 130 feet (40 m) to his death after he lost his footing while leaping into the air for a ""flying selfie"".",[104][105],2016
July 2016,Croatia,1,Fall,"A 20-year-old Canadian tourist plunged off a viewpoint 75 meters (246 ft) high in the Plitvice Lakes National Park, Croatia, while trying to take a selfie. His fall was broken by tree branches and he survived with injuries. It was the park's second selfie accident in a year.",[46][47],2016
2 July 2016,India,1,Fall,"A 32-year-old resident of Mali Mohalla, near Saharanpur Chowk, Dehradun (India), lost his life after he fell in a 150-feet deep gorge while taking a selfie near Chunakhaal on Dehradun-Mussoorie road in Uttarakhand, India. This is not the first incident of this kind on the road. Last year, a youth died when he stepped backwards and fell into a deep gorge while his friend was clicking a picture.",[106],2016
6 July 2016,India,4,Drowned,"Four students were taking selfies near Purva waterfall on Tamas River in Rewa district of Madhya Pradesh, India. They were unaware of an oncoming flash flood and all four were swept away and drowned.",[107],2016
12 July 2016,India,1,Fall,"A 36-year-old and a friend climbed to a mountain peak at Khandala, India, against warnings. There they took selfies with a waterfall in the background, but the 36-year-old slipped and fell into a 200-foot-deep quarry and died.",[108],2016
12 July 2016,Nepal,1,Animal,"In southern Nepal, a truck driver stopped for a wild herd of 21 elephants crossing the road. The driver exited his vehicle to take a selfie with the animals. The herd attacked and killed the man.",[109],2016
13 July 2016,India,2,Drowned,"Two students drowned while taking selfies at Kosi Dam near Rampur, Uttar Pradesh, India. A group of students were taking selfies and became trapped in a vortex; the rest were saved.",[110],2016
13 July 2016,Vietnam,2,Transport,"In the province of Hung Yen, Vietnam, two men aged 21 and 28 were hit and killed by a train while taking a selfie on the tracks. Bystanders tried to shout warnings at the men but they could not hear them due to wearing earphones.",[111],2016
17 July 2016,India,2,Drowned,"A married couple ages 40 and 42, from Tirupur district of Tamil Nadu, were swept away by a ""giant wave"" in Kanyakumari, India while they were taking a selfie.",[112],2016
19 July 2016,India,2,Fall,"In an incident reported on July 19, two people were taking selfies at Alekan waterfall in Charmadi Ghat, India. The two, Hanumanthappa (34) and Nagabhushan (38), residents of Chitradurga district, lost balance and fell into the waterfall. They were both killed.",[113],2016
23 July 2016,India,1,Fall,"At Amboli Falls, a popular tourist destination in Sindhudurg district in Maharashtra, India, a youth fell into a 60-foot-deep gorge while taking a selfie. He died.",[114],2016
27 July 2016,India,1,Drowned,"A 24-year-old woman was swept away to her death by the swollen waters of Baandal river near Maldevta area on the outskirts of Dehradun, India. She was taking a selfie at the time of the incident, bringing the toll of selfie deaths in Dehradun to four for the year.",[115],2016
30 July 2016,India,1,Drowned,"A 20-year-old national-level athlete slipped and fell into a pond while taking a selfie near a harvesting plant at the Sports Authority of India (SAI) centre in Bhopal. She did not know how to swim. Her two companions, who also were unable to swim, ran for help. She was taken to a hospital where she was pronounced dead.",[116][117],2016
31 July 2016,India,2,Fall,"A 24-year-old Indian man, a well-known local-level wrestler from Bhadohi, fell to his death while taking a selfie near the Vindham waterfall in Uttar Pradesh. A friend who dived into the water to rescue him was taken to the hospital in critical condition.",[118][119],2016
2 August 2016,United States,1,Firearm,A 22-year-old Florida woman accidentally shot her phone while taking a picture of herself for Snapchat while posing with a .40 caliber pistol. She suffered minor injuries to her hand. The phone was shattered.,[120],2016
3 August 2016,India,1,Fall,"A 22-year-old engineering student from Andhra Pradesh was vacationing with six friends in Tamil Nadu state, South India. While taking a selfie standing on the edge of a 2,000-foot-deep gorge at Vilpatti village on upper Kodaikanal hill, he slipped and plunged to his death.",[121],2016
7 August 2016,India,1,Fall,"A 27-year-old lawyer from India was visiting Mandoshi ghat, near Bhimashanjar. She and her husband were sitting on boulders that form a safety barrier from a 100-foot gorge below. As she positioned herself for a selfie, one of the boulders came loose in wet earth, and she slipped over the edge. Her husband attempted to arrest her fall but was unable to hold on. She sustained head injuries and was taken to hospital by her husband, where she was pronounced dead.",[122],2016
9 August 2016,Pakistan,3,Drowned,"An 11-year-old Pakistani girl drowned while attempting to take a selfie at the Kunhar River, which flows through Khyber Pakhtunkhwa province in Pakistan. The girl's mother jumped into the fast-moving river to save her but she was also swept away and drowned. On seeing both his daughter and wife in trouble the father jumped in; he also drowned. The dead bodies of the mother and her daughter were found; the father's body was missing. The six-year-old son of the family was a witness of the tragedy.",[123][124],2016
12 August 2016,India,1,Fall,"A 22-year-old student of Kherva Ganpat University, Mehsana in Gujarat, India, climbed a glass dome on the third-floor terrace of a building to take a selfie. The fragile glass collapsed and she plunged 70 feet to the ground floor and was killed. Selfies were subsequently banned at the school in ""risky places"".",[125],2016
12 August 2016,India,4,Drowned,"Four Indians aged 15–19 were taking selfies in the ocean surf in Maharashtra. Unsatisfied with the pictures and ignoring a storm, they went further out from shore. They were carried away by a large wave and their bodies were not recovered.",[126],2016
15 August 2016,India,1,Fall,"A class 12 student residing at Peelamedu, India, was sightseeing with friends and noticed a huge well dug in a field. While leaning over the edge of the well to take a selfie to show its depth, he slipped and fell in. The well is 120 feet deep with a water level of 60 feet. He died in the well before he could be rescued.",[127],2016
16 August 2016,India,1,Firearm,A 35-year-old Indian woman from Muzaffarnagar was taking a selfie with a gun when it fired. She sustained serious injuries.,[128],2016
20 August 2016,Pakistan,2,Drowned,"A Pakistani man drowned while attempting to take a selfie at the Kunhar River that flows through Khyber Pakhtunkhwa province in Pakistan. His cousin jumped in to save him, but she was also swept away and drowned. It was the second selfie-related death incident on the Kunhar River in August.",[129],2016
21 August 2016,Pakistan,3,Other,"Three Pakistani women were killed while taking selfies near a road at Lake Saiful Muluk. They were inside a melt hole, or cave, at the front edge of a receding glacier when the roof collapsed and they were crushed.",[130][131],2016
